 teams entered the competition and portugal defeated france in the final to win the competition for the third time,0
 cattle were killed in matsilojematshelagabedi and  cattle in matopitseteng,0
bbc blowjob in car hd mexican border patrol agent has  own ways  ,1
couple exchange  they love it hard part  ,1
extreme couple bound their housewife ,1
step son can   so gets sex  mom ,1
 different teams  different drivers  different chassis and  different engines competed,0
 queens boulevard is an american sitcom that aired from march  until july  ,0
muscular top throatfucking cell mate ,1
close up slowmo pussy fuck  cum  open hole wet teen pussy gets creampie ,1
 jeanne provisional designation  qj is a dark asteroid from the background population of the intermediate asteroid belt approximately  kilometers in diameter,0
 urberach where he also works with the clubs u squad,0
 kiddie favorites is a compilation album by the punk rock band jugheads revenge released in ,0
 is horny  wants  eat pussy in  pool ,1
 of the districts inhabitants speak finnish as their native language,0
 is the seventh studio album from the italian nu metal band linea ,0
mom horny blonde milf craves  cock ,1
brit milf dominated  fucked roughly by big dick dom ,1
picked up in public big tits blonde gets fuck ,1
 depicting guglielma blessing abbess maddalena albrizzi and an unknown donor hangs in the church of san andrea in brunate,0
 camus provisional designation  sf is a carbonaceous asteroid from the central region of the asteroid belt approximately  kilometers in diameter,0
 comae berenices  com is a spectroscopic binary in the constellation coma berenices,0
   is the debut ep by recoil released in august ,0
sex tape with huge melon juggs slut office girl stephani moretti clip  ,1
 children died there while in the care of the christian brothers mainly from abuse and neglect,0
 fm long beach california and kbua  fm san fernando california are a trimulcast comprising que buena  fm a spanish language regional mexican music station owned by liberman broadcasting,0
 tough  muscular latino man in  trap  fuck  boss  daughter bearded  hot  will fuck  girl hard while  will delight him with oral sex  strong thrusts so that  does not stop having orgasms cock addiction  ,1
what dreams may cum marcus mojo nick spartan ,1
let  fuck that butthole ,1
 women and  men competed in challenges in an attempt to become her new best friend,0
mom rides one eyed monster as  cowgirl ,1
 acres wd owned at cost to govt land and buildings of  certified to sps wd  october ,0
slut for chrissy daniels lance hart femdom pegging strap  ,1
 years of alcohol is a  drama film written and directed by richard jobson based on his semiautobiographical  novel,0
busty glamcore euro takes bbc before feet cum ,1
 avenue of the americas is a story office building located in rockefeller center in new york city,0
sexy redhead all wet in  shower ,1
 wilkens provisional designation  eq is a mitidika asteroid from the central region of the asteroid belt approximately  kilometers in diameter,0
 swings provisional designation  qo is a dark asteroid from the outer region of the asteroid belt approximately  kilometers in diameter,0
stepbrother cum in my panties  pull them up when parents home ,1
 september  had announced the launch and presented fifty contestants from the audition,0
 states subscribed to the last iteration of the initiatives joint statement in ,0
th virginia was organized in may  with men from richmond and henrico and hanover counties,0
 is the debut studio album by british pop duo bars and melody,0
   is lamidanda  is danchot  is ramli  is lapal    is uma,0
glamcore teenie anally riding big black cock ,1
mexican butthole vs bbc ,1
pmueller also known as mueller  is a periodic comet in the solar system,0
 carla provisional designation  sd is a carbonaceous asteroid from the outer regions of the asteroid belt approximately  kilometers in diameter,0
ampm  the midday report with john and brad is broadcast live from the casey jones village in the dixie cafe or on the road at various locations in jackson tn,0
 and commissioned as uss cauto on  july  with lieutenant commander j r curtis usnrf in command,0
th group has also been involved in parts of africa and the middle east,0
wicked mama rides  receive orgasm ,1
pawg babysitter rides until cum  pov ,1
th street was a local station on the demolished irt second avenue line,0
 mothers was an art exhibition curated by harry pye that originally took place at the oh art gallery at the oxford house bethnal green in march ,0
free legal age teenager bizarre porn ,1
 khajoor road is the sixth album by the indian band indian ocean the first one after the tragic demise of asheem chakravarty,0
cis retinol dehydrogenase is an enzyme that in humans is encoded by the rdh gene,0
free  sexy porn ,1
 classic book collection known in north america as  classic books is an ebook collection developed by genius sonority and published by nintendo which was released for the nintendo ds handheld video game console,0
nurse milf mom soothes injured son series parts   ,1
 competitors from south africa won  medals including  gold  silver and  bronze and finished th in the medal table,0
alyssa hard fucking  guys same time ,1
 the resort was declared a special tourism economic zone by president gloria macapagalarroyo,0
sultry teens pussy licked ,1
bitches abroad  lovita fate  lutro city break romance with  sexy czech blondie ,1
best blow job compilation catherine grey ,1
biarnadski won a bronze medal in the same division six months earlier at the  european amateur boxing championships in pula croatia,0
busty british redhead milf red riding  cock ,1
horny best friend discreetly touches friend ,1
heavenly blowjob experience in hd ,1
 matches were contested at the event including  broadcast exclusively on sunday night heat,0
busty blonde odd insertions ,1
 minuten wahrheit is a german film directed by nico zingelmann and starring herbert knaup and christoph bach,0
 episodes of the show were shot but only  were broadcast,0
 am is a regional broadcast frequency,0
 firwood fold is a thcentury house in bolton greater manchester grid reference sd,0
husband  wife seduce babysitter into threesome ,1
cock loving lingerie lady watches jerk off ,1
 councils swung to labor control and the party gained  council seats,0
th annual venice international film festival was held from  august to  september ,0
 sports arts and other extracurricular activities are offered and an outdoor education program prep to year  is provided for those staying after school,0
busty brunette bride jasmine jae fucks  brother   groom ,1
nice black girl gets boned real hard ,1
 of the united nations international labor organization ilo adopted internationally on  june ,0
bf sucks amateur house wife really good ,1
pawg goddess veronica bottoms takes  don prince  bbwhighwaycom ,1
 grams norwegian  gram is a  norwegian drama film written and directed by bent hamer,0
 squadron raf was a second world war royal air force squadron that operated the north american mustang on missions over occupied europe and in support of the dday landings,0
nubiles porn fucking my girlfriends hot russian step sister ,1
girl fucks herself in  ass with big sex toy while no one is home ,1
brunette rachel starr fuck  lucky neighbor ,1
busty blonde gilf bibi pink fucked by young hard cock ,1
cumshot  my indian wife hairy pussy   ,1
mommybb handjob  mature mom with big tits here ,1
 they seem to have been a particularly popular genre during the second half of the th century ie during the artistic revival spearheaded by the qajar ruler nasir aldin shah who reigned from  to ,0
alice frost is amber stars ass cleaning toilet slave ,1
 love spying   beautiful aunt chantal while  peeing ,1
year major league veteran joe sommer managed superior and otto krueger who spent seven years in the majors managed winnipeg,0
xt  real orgasm sexy girl with g boobs eaten until  cums  taps out ,1
 helicopter flight hovering hawks is a forward air control helicopter squadron and is equipped with hal cheetah and based at udhampur air force station,0
th howitzer battery joined the brigade in may ,0
big booty worship ,1
teaching  year old hottie  kick balls ,1
blowjob service  ,1
 directed by bertrand tavernier,0
 of the first cd pressings of this album include an unlisted th track called how the hell did they get there and was only available on limited edition copies at littlewoods stores in the united kingdom,0
 abc ballarat callsign crr is an abc local radio station in ballarat victoria australia,0
bridgette  superb girl with big round butt love deep anal sex clip  ,1
 granule also designated a fa is a stony florian asteroid from the inner regions of the asteroid belt approximately  kilometers in diameter,0
 municipal council members were elected as well as  members of the amts of denmark,0
limit  selvaggia  hardcore threesome with double penetration for russian teen ,1
 songs competed and the winner was drama queen sung by peter andersen as dq a wildcard entrant,0
 billion of these estimated planets may be orbiting sunlike stars,0
 shajna provisional designation  rf is a stony asteroid from the inner regions of the asteroid belt approximately  kilometers in diameter,0
 gluts are encoded by human genome,0
hydroxyeicosatetraenoic acid also termed hete shete and shete is an eicosanoid ie a metabolite of arachidonic acid,0
 scale is a popular scale used by model ship kit manufacturers such as tamiya hasegawa aoshima fujimi trumpeter and revell,0
pervcity big booty anal babe alexa chandler ,1
 is a largescale revision from  it lasts about  minutes,0
 competitors from kenya won  medals  gold and  bronze to finish st in the medal table,0
dancingcock fat black cock dancing ,1
th regiment indiana infantry was an infantry regiment in the union army during the american civil war,0
   agra fort  ajmer junction intercity express is a superfast express train belonging to indian railways north central railway zone that runs between agra fort and ajmer junction in india,0
privatecom  amazing anastasia brokelyn blows black cock ,1
 helicopter flight featherweights is a fighter squadron and is equipped with mil mi and based at chandigarh air force station,0
 legends is the fourth and final james bond game title released by activision the last game eurocom developed before the company ceased operations and also the last james bond video game to be available on home video game systems to date,0
teensdoporn lovely barely legal brunette casting sex ,1
huge load facials compilation hd videos ,1
 of them are in uttar dinajpur districrt of west bengal and the rest are in katihar district of bihar,0
 of his lps met the  album sales mark in the uk to be certified silver with eight of those going on to sell  copies for gold certification and one of those eight the johnny mathis collection  making it to the  total necessary for the platinum award,0
 year old couple  anal creampie pretty blond girl next door fucked in  tight asshole flawless body ,1
   new delhi kathgodam shatabdi express is an indian train of the shatabdi express category belonging to northern railway zone that runs between new delhi and kathgodam the nearest railhead to many tourist destinations in uttarakhand like nainital ranikhet etc,0
 other students transferred to compadre at the beginning of the school year,0
fuckin my friends mom  almost got caught ,1
 members are imprisoned by israeli authorities and three are deceased according to the count on  december ,0
naughty eurobabe pile driven hard by cock ,1
s red medicine became the highestcharting album of fugazis career reaching no,0
busty cheerleader in hot pants takes  cocks ,1
gloryhole secrets blonde mouthfuls  cum ,1
 capacity juba stadium is their home,0
 independent reconnaissance flight was an australian army aviation unit of fixed wing and rotary aircraft,0
two jock guys bareback fuck each other real hard ,1
 morishita provisional designation  fc is a stony asteroid and exceptionally slow rotator from the middle region of the asteroid belt approximately  kilometers in diameter,0
blacked first interracial threesome for blonde naomi woods ,1
 out of  teams qualified after a match regular season six from each conference,0
 am is a clearchannel frequency shared by canada and the united states,0
th planet jiujitsu is a nontraditional system of brazilian jiujitsu developed by eddie bravo,0
isabella ass gaped  prolapsed by dildo before milk enema ,1
 people were killed in the crash but navarrete and fellow politician alejandro murat hinojosa escaped with comparatively minor injuries,0
 movies list and th on their  updated list,0
 teams participated in the finals tournament in south africa seven of which came through qualifying matches,0
 is a french hip hop group with african and caribbean roots originating in north and west africa and the island of guadeloupe formed in the parisian suburb of vitrysurseine,0
 laps later johnson took the lead for one lap,0
wild  amorous cowgirl riding ,1
 athletes participated in the festival from  different countries,0
 swimmers were entered in the event of which  swam in one of  preliminary heats,0
 broadway is a story office building in portland oregon,0
village girl fucked by  rich man ,1
methoxytabersonine is synthesized by methylation of the hydroxyl group at the  position of hydroxytabersonine by tabersonine omethyltransferase omt,0
horny petite teen with small ass hole defloration ,1
 commando supported by ten men from the norwegian  ia commando captain harald risnes,0
 political prisoners were burned alive including the actor and director yukhimenko,0
best pov handjob compilation ,1
gags   cocks  hardcore asstomouth ,1
femdom fucks slave with dildos  plugs  mistress angelina ,1
interracial gangbang with double fisting for veronica avluv  monika wild ,1
my hooker  me  short version ,1
 roles typically pay less than a fullblown regular but the role still renders an actor ineligible for other pilotsseries,0
 with perfect body ,1
nickey huntsman takes big dick in  bottom ,1
superlatively good anal sex porn ,1
 like  play games  full movie  ,1
 mimi provisional designation  aj is a dark background asteroid from the central regions of the asteroid belt approximately  kilometers in diameter,0
my slutwife with my best friend ,1
felching bareback threesome ,1
raw attack  julia ann is pounded by  big dick big booty  big boobs ,1
eroticax forever in  day ,1
 issued by president gloria arroyo,0
 teams took part in the league with fc spartak moscow winning the championship,0
 teams will participate in the two indoor tournaments while  pairs will take part in each of the beach volleyball events,0
outdoor public nudity  private vices vol  ,1
cougar lilith enkur wants your cock ,1
 players was added to the mix creating the raiders we know today,0
 was the bmts designation for service on the bmt fulton street line not to be confused with todays ind fulton street line which uses a portion of the old bmt line at its east end,0
sweet  freshman leanne takes  wet pussy pounding  mouth fucking ,1
 one hundred and sixtyeight is the natural number following  and preceding ,0
blacked thirsty teachers assistant craves  professors bbc ,1
pakistani girlfriend rubina fucked hard by  boyfriend ,1
busty eurobabe seduces lucky guy ,1
 is a compilation album released by wwe on january  ,0
 indian athletes participated in rio   men and  women across  sports at the games,0
th street is a side platformed sacramento rt light rail station in downtown sacramento california united states,0
realitykings  teens love huge cocks  chris strokes scarlett fever  beaver fever ,1
 of these are capesize while  are panamax of which  capesize and  panamaxes are sold when delivered from yard,0
 feet above sea level flagg is recorded in the domesday book as flagun and is believed to have originally been a viking settlement engaged primarily in lead mining the evidence of which can still be seen today with many spoil heaps and disused mine shafts in the area,0
legalporno full scene  hot teen lana gets  ass fucked ,1
elegant chick enjoys arse fuck ,1
 vomit heaven  fucked my throat until  puke gallons snot dirty ass  mouth hard slap ,1
 competitors  men and  women took part in  events in  sports,0
francys belle ass fucked raw in public ,1
sex with cris monti oral pussy fuck cum in mouth multiple orgasm ,1
 outfielders and eleven shortstops were selected,0
old enough  be  father ,1
young latina alicia poz fucked hard by  bodybuilder hardcore porn ,1
 squadron finnish lentolaivue  or llv was a divebomber squadron of the finnish air force in world war ii,0
ebony grabbing  huge boobs tease  cam ,1
british granny amanda degas fingers  creamy old pussy ,1
glamour mature lets hubby assfuck babe ,1
 airsea rescue flight transported australian prisoners of war home to australia and performed other tasks to support australian units in borneo,0
 competitors  men and  women took part in  events in  sports,0
th house is a  album by jazz pianist mccoy tyner released on the milestone label,0
girl with amazing ass yui hatano pumped in various modes ,1
black ass masturbation ,1
 teams participated in the league and jyp jyvaskyla won the championship,0
 competitors  men and  woman took part in  events in  sports,0
 brickell is located behind the existing  brickell office building and actually has frontage at  southeast st avenue not on brickell avenue,0
 caliber gun mark  was a us naval gun mounted on the alaskaclass cruisers,0
 competitors  men and  women took part in  events in  sports athletics boxing and weightlifting,0
 competitors all men took part in  events in  sports,0
redhead bbw with big tits takes big black cock ,1
maximum miscegenation asian caucasian style ,1
 contestants competed for crown,0
sexy women do their best  look nice in  three some ,1
 squadron raf was an aircraft squadron of the royal air force,0
tory lane sucks off lucky fan ,1
 also went to number  on the billboard rb chart,0
th arrondissement of marseille is one of the  arrondissements of marseille,0
hydroxydihydrocodeine is not currently marketed in any developed country but has been of interest to pharmaceutical companies looking for new analgesics and antitussives,0
fingering in hotel room while they hear loud moans ,1
 countries have nonresident embassies accredited from other regional capitals such as vienna in austria and rome in italy for diplomatic and consular purposes,0
emma stone shaved pussy sex mrdeepfakescom ,1
exploited tiny teen who still has braces ,1
 is a natural number,0
dick teasing creampie ,1
wetting  stuffing my panties in my puffy wet pussy ,1
family stepdads side   bed ,1
 amateur busty asian whore serving  customer ,1
 touch fm is a british independent local radio station that broadcasts to the warwick leamington spa and kenilworth areas of warwickshire,0
 kanagawa provisional designation  ar is a carbonaceous asteroid from the outer region of the asteroid belt approximately  kilometers in diameter,0
deepthroating  hard anal with katja kassin ,1
 of the  passengers and crew on board were killed in the crash,0
hairy amateur licks  fucks more  more ,1
 eckert provisional designation  na is a stony slow rotating hungaria asteroid and marscrosser from the inner regions of the asteroid belt approximately  kilometers in diameter,0
evilangel goth gf has  prolapse licked  fucked ,1
th anniversary the world championship was hosted in canada for the first time,0
double amateur blowjob pov with teenegers jasmine  hanna ,1
 competitors all men took part in  events in  sports,0
glam whore gets creamed ,1
hottie blondie chessie kay pissing in public ,1
th indiana infantry regiment served in the union army between october   and july   during the american civil war,0
homemade femdom  stunning horny milf fucks  face  squirts ,1
 also known as over there  is a  french documentary film about world war i directed by jean aurel,0
 reward is a  american short silent drama film directed by jack harvey for the thanhouser company,0
gorgeous teen babe fucked hard ,1
it contains the majority of the city center,0
 dresses was recognized by the american library association on the  rainbow book list as a stonewall childrens and young adult literature honorbook and a  lambda literary award finalist,0
th street carries illinois route  from thornton street to wolf road and carries us route  from wolf road to torrence avenue,0
 people living in their own house,0
golder shower  monster cocks ,1
white coed ruined by monster bbcs ,1
 of these properties and districts are located within the city of spokane while the remaining  properties and districts are located elsewhere,0
 offensive players  defensive players and  special team players are voted by the head coaches and  players on each of the  x teams to be selected for the team,0
 dadar madgaon jan shatabdi express is a superfast express train belonging to indian railways  konkan railway division that runs between mumbai and madgaon in india,0
hot big ass girl getting fucked very bloodyly ,1
diiodobutadiyne is a small molecule related to diacetylene,0
 greatest african americans is a biographical dictionary of one hundred historically great black americans in alphabetical order that is they are not ranked as assessed by temple university professor molefi kete asante in ,0
stunning amatuer teen sucks an old cock  gets team fucked hard ,1
 monkeys is an independent funk rock band from los angeles california,0
daughter gets stuck  dad get  fuck  pussy with creampie ,1
 runners from  nations participated,0
hot college girl handjob at night ,1
load moaning lucy ravenblood smoking cigarette while riding cock ,1
fist flush hot babes  full fisting lead  insane cum ,1
 general house bills  local house bills  general senate bills and  local senate bills passed both chambers of the legislature and were sent to the governor for his signature,0
vicious couples fucking together vol  ,1
 squadron is a royal australian air force raaf maritime patrol squadron based at raaf base edinburgh,0
mom early morning love making ,1
sexy woman mini dress ,1
 species have been described but only  accepted,0
 are represented here while  are more easily constructed from the cube,0
 wing raf was a formation of the royal air force during the second world war,0
 was not silent long as wbsm in new bedford massachusetts was given permission to move to  in  where it remains to this day,0
daughter pinned down  fucked by father ,1
 german athletes  men and  women participated in london,0
culioneros  big tits babe amy wild is almost too pretty for porn ,1
mommy got boobs  fix my pussy scene starring brenda james ramon ,1
 swimmers were entered in the event of which  swam,0
 hours was produced through cosmic entertainment which counts kurt russell goldie hawn oliver hudson and kate hudson as its principals and sponsored by johnson  johnson,0
mom dressing up spied in morning ,1
 competitors from poland won  medals  gold and  bronze and finished th in the medal table,0
perverted mechanich screw  young bitch ,1
pale pussy lauren phillips dick stuffs  creamy sex box ,1
 episodes were ordered by nickelodeon but only  were aired,0
 catriona provisional designation  gd is a carbonaceous asteroid from the outer regions of the asteroid belt approximately  kilometers in diameter,0
 helicopter unit siachen pioneers is a helicopter unit and is equipped with hal cheetah and based at leh air force station,0
bubble bath ,1
creamy ass play   tattooed teen hottie ,1
 northern territory mha vaiben louis solomon vacated his seat when he was seated in the first parliament of australia on  may ,0
dutch prostitute riding ,1
petite naive thai woman feels masseur enter  young pussy without condom ,1
big booty milf aka my boys mom  told   leave me alone press play ,1
anal makes freak go wacko ,1
ex girlfriend   cums  gets cummed upon  cliplips free porn videos ,1
big tits emori pleezer rough ass eating spit  face fuck ,1
 one hundred and fortyeight is the natural number following  and before ,0
hot anal   bed ,1
 competitors  men and  women took part in  events in  sports,0
 strips were published,0
hot brunette japanese girl anal extreme sex uncensored ,1
 wall street originally the bankers trust company building is a skyscraper at  wall street at the corner of nassau street and running through to pine street in the financial district of manhattan in new york city,0
 december the security council noted the call within the secretarygeneral kofi annans report for the authorities in cyprus and northern cyprus to urgently address the humanitarian situation concerning missing persons,0
public agent josephine jackson exposes  big boobs  fucks ,1
my south korean friend destroying my ass imvu boys ,1
alt chick sparky sin claire puts  dicks inside  ,1
cute babe jerk off  fucking vagina toothbrush after shower  solo ,1
 executions were performed in  and  executions were performed in ,0
 am wbiw also carries indianapolis colts football indiana pacers basketball nfl football ncaa football purdue university sports as well as indycar series racing and the indianapolis ,0
n tracing is applied in biogeochemistry soil science environmental science and environmental microbiology,0
 squadron was a flying squadron of the royal air force raf,0
 years of girl guides is a bbc television documentary,0
girl losing at strip poker game with  friends ,1
 fifteen is a number numeral and glyph,0
vsb is an abbreviation for level vestigial sideband modulation capable of transmitting four bits  at a time,0
assfucking blonde exgf fucks  sucks ,1
 australians fought under the command of the united nations until the armistice in ,0
ass toying babe squirts loads  juice ,1
hungover roomie letting me fuck   cum in  mouth real home video ,1
little teen cheerleader sucking  fucking cock ,1
