trigalloyl glucose is an gallotannin,0
among several claims melaleuca inc claimed that hansen violated the canspam act by emailing melaleuca executives and trying to induce them to leave the company,0
 one hundred and eighteen is the natural number following  and preceding ,0
femdom goddess gets off then ass fucks  slaves ,1
juliet uncensored peeing   pissing fan shaving  hairy asian pussy ,1
petite lita phoenix with perfect boobs gets copious cum  ass ,1
young slut blows big cock with pleasure ,1
 teams from around the world competed in the  m challenge season up from the  teams that competed in ,0
marica hase fucks  black cock ,1
tiny tits girl acquires long one eyed monster ,1
 was released on july  ,0
 of their singles reached the billboard top  singles chart in the us while  singles registered on the top  of the us rb chart two of which went to  on the chart,0
danejones hot fuck  couch with cute brunette ,1
monica visits  gynecologist ,1
 cunt expands while fucking ,1
tattooed bigtit slut blow my dick  ride me untill cum   tits ,1
 wire has good fuel and oil resistance,0
deep throats  huge black cock ,1
lesbian threesome full scene   horny college girls have girl  girl sex ,1
skinny brunette showing  perfect body ,1
brutalclips  naughty asian gets punished ,1
 and remaining in the charts for a year and a half,0
hot pretty cutie ass fucked ,1
 of the remaining seats were won by the liberal democrats whilst the remaining  were won by labor,0
 cases had been reported as of ,0
 luthera provisional designation  fp is a dark asteroid and the parent body of the luthera family located in the outermost regions of the asteroid belt,0
bulge watching ,1
 having passed the threshold of  graduates the seat of university of sydney was created,0
legal age teenagers having sex free porn ,1
th street is now signed as interstate  business,0
cheating cougar krissy lynn blows stepson  shut him up ,1
free porn enchanting legal age teenager ,1
 string guitar is an instrumental folk album featuring the  string guitar of american singerguitarist glen campbell released in  see  in music,0
 mesierbrewer house and newer ones like the village hall formerly a post office designed under the supervision of franklin d roosevelt during his presidency,0
 competitors  men and  women took part in  events in  sports,0
two teens stuff guys ass ,1
 km is a passing loop in leninskkuznetsky district russia,0
blonde milf shows off  massive tits while talking dirty ,1
 mcgill college avenue was designed in  by montreal architecture firm ross and macdonald and was completed in ,0
 sailors on  boats from  nation competed,0
shaming face fuck treatment ,1
super hot amateur teen babe fucked in stockings ,1
hot lesbian babes spit down each other ,1
doubleviewcastingcom  roberta slides  big joy stick pov view ,1
bigtit moneyshots ,1
trike patrol  beautiful petite filipina takes huge white cock ,1
cumshot compilation  watch some  my hot cum facials ,1
rd cavalry regiment was a unit of the pennsylvania national guard that existed from  to  when it was redesignated the th field artillery regiment,0
randi hard fucked by  students ,1
   is a duet studio album by herbie hancock piano and wayne shorter soprano saxophone,0
 individuals accused of being leftist supporters of farc were massacred by paramilitary groups with support from members of the colombian army,0
you cum  ariana marie  face after  pov virtual date with hardcore sex  wwwsweetcamstk ,1
beautiful brunette rubbing  pink pussy cream  cam   xxcamnet ,1
  published by archie comics in august ,0
 is a  american musical drama film directed by peter h hunt,0
exhibitionist blonde sunbathes topless by  bush  trailer for  video ,1
honey is double penetrated ,1
loveherfeet  passionate sex with hot brunette amia miley behind  boyfriends back ,1
 referees and  assistant referees were chosen from around the world to officiate the  games that made up the final tournament,0
college teens fucking in group orgy ,1
that was james last appearance in contemporary sources,0
 batches have passed out since the  session,0
blonde wife cheating  husband ,1
passion hd oiled up massage fuck with brunette busty layla london ,1
superb russian beauty gets immense fantastic dildos in  wide holes ,1
 is a compilation album by four tet released by text records in january ,0
sit   face  make him eat  pussy ,1
 of niets  or nothing was a flemish tv quiz broadcast on the flemish public service tv station nir nowadays the vrt between  and  on sunday evenings,0
two beautiful sluts fuck two step brothers ,1
cute amateur fuck slut shows  skills ,1
rd street was a station on the demolished irt third avenue line,0
 antiaircraft regiment is an artillery regiment of the south african army,0
 items or less is a partly scripted partly improvised american comedy series created by nancy hower robert hickey and john lehr,0
 apocalypse is a  television miniseries written and directed by john lafia,0
realitykings  monster curves  brick danger ryan smiles  office fling ,1
 mumbai ltt  madgaon ac double decker express is a double decker train of indian railways which is the first of its type to be introduced,0
 was the th english cricket season since the earliest known important match was played,0
rough gang group sex ,1
ass traffic presents lien parker in anal scene ,1
 per cent of the ridings residents were immigrants including  german and  ukrainian,0
chubby milf cheater fucked by  new partner ,1
trinity st clair kobe lee  tanya tate at mommy  girl ,1
 locomotives were built between  and  to replace the yearold and aging class  as the flagship of the db ag primarily hauling intercity services,0
creampie delight for sexy playgirl ,1
lesbian slave rough anal fucked with strap  ,1
 municipal council members were elected as well as  members of the amts of denmark,0
dude tapes while anal fucks euro babe for  first time ,1
another fun night watching some porn ,1
hrs is a  british horror film directed by jonathan glendening,0
busty milf officer anal fucked in rope ,1
  and  are still in print but the outofprint volumes are being scanned and added to the university of hawaiis digital repository,0
 cameras were used,0
girlsrimming  threesome first timer adira allure ,1
only ass  ,1
 john street is a historic office tower at the southwest corner of john street and pearl street in the financial district of lower manhattan in new york city,0
fucking my step daughters hot best friend ,1
 september is the day of malaysias establishment,0
fat asses  collins avenue in miami beach hd ,1
 squadron was a royal air force squadron that saw service in both the first and second world wars,0
under total domination humiliated bitch cony ferrara mouth fucked  screwed painfully in  all holes bdsm movie hardcore bondage sex ,1
argentine teenagers we started in buenos aires ,1
girlfriend sold  boss for promotion ,1
 bce or during the late helladic i period,0
office lesbians go at it ,1
 financing zero percent alternatively known as discounted finance is a widely used marketing tactic for attracting buyers of consumer goods automobiles real estate or credit cards in different parts of the world,0
big tit milf suspect faces cock time at  storage room ,1
 long night  my brother full movies ,1
 imprinetta provisional designation  hm is a carbonaceous meliboean asteroid from the outer regions of the asteroid belt approximately  kilometers in diameter,0
 teams competed and the defending champion ordu kabul fc topped in the table once again by winning  out of  games played,0
periscope sexy girl pussy bating  do selfie ,1
latina teen with bubble butt  hard cock ,1
titty amateur blows for cash in  park ,1
 gallery has been frequented by los angeles residents such as raymond pettibon david lee roth tomata du plenty and john belushi,0
 others were critically wounded,0
big ass sailor moon  bubble butt  meaty pussy perky tits ,1
 cannonia provisional designation  rv is a stony florian asteroid from the inner regions of the asteroid belt approximately  kilometers in diameter,0
boobs free milking rimming porn video ,1
teen loses  dare so  bff eats  pussy ,1
th infantry regiment is an infantry regiment of the new jersey army national guard,0
huge cock fucking two sexy sluts nl   ,1
teen blows fake cop in  back seat ,1
 lictoria provisional designation  fb is a hygiean asteroid from the outer regions of the asteroid belt approximately  kilometers  miles in diameter,0
girls try anal  phoenix marie ana foxxx ,1
busty stepsister helps with some titty fucking ,1
bus fuck ,1
it also inhibits ck epsilon,0
tuktukpatrol covid  lockdown sex with playful asian ,1
fucked my mature aunt   th birthday ,1
 years later on  june  rtm hd has officially launched as a trial transmission exclusively on mytv broadcasting on channel on  july   month after rtm hd launched it changed to rtm sports hdits officially first rtm having dedicated sports channel after depending tv tv and tv okey broadcast sports program but its still in test transmission,0
           delhi raxaul sadbhawna express is a express train belonging to indian railways  northern railway zone that runs between delhi  raxaul junction in india,0
 of the student population originates from algonquin and ward islands and about  of the students live in the city and take ferry transportation to school,0
lets hope they dont get busted ,1
sex with two real porrnstars in california filmed pov amateur  lily adams  elena koshka ,1
 per brahe provisional designation  ch is a bright asteroid from the middle region of the asteroid belt approximately  kilometers in diameter,0
  is a decision of the united states supreme court holding that a principle in the abstract cannot be patented and no one can claim in it an exclusive right,0
 year old bbw fucked during casting ,1
 masturbate  watching porn   ,1
tushy riley reid first double penetration ,1
 of the votes were invalid,0
sheilas big boobs massaged with  hard piston ,1
 kda phosphohistidine phosphatase is an enzyme that in humans is encoded by the phpt gene,0
th is a  american documentary by director ava duvernay,0
 mommy christmas clause modern taboo family ,1
 street provides access to the university of alberta the downtown core and whyte avenue,0
naked nubiles having sex ,1
my ex gf ,1
lesbian eats hairy pussy ,1
th heavy antiaircraft regiment royal artillery th haa rgt was an air defense unit of the british army formed during world war ii,0
 squadron is a unit of the indian air force assigned to maintenance command,0
stirring up hunks wild wants ,1
 athletes from five nations competed in the middle of the three hurdling events,0
fucking college sluts ,1
 acresthe bioregion has the code mii,0
th street is a rail stop in the central city neighborhood of michigan city indiana,0
busty amateur chick has  threesome  camera for money ,1
indian shy gf fucked by bf hardly ,1
new lover for deprived wifey ,1
gamer dreamin play n fuck ,1
shy legal age teenager porn tube ,1
 seats were contested in this election the first since the whole council was elected in  following a boundary review,0
 of the population is muslim the highest in canada,0
 cyclists from  nations took part,0
 years later br as part of the beeching rationalization plan closed the roudham junction and swaffham line including roudham junction station on  june ,0
 candidates contested for the  constituencies in the assembly,0
summer holiday with my best friend ,1
  want love step mom ,1
hairy moist snatch mom takes two dildos   clit making  moan ,1
shoplifting milf stepmom sucked  stepsons dick for silent ,1
 times better italian  volte meglio vm whose official name is italy  times better is a liberal political party in italy,0
rd infantry regiment is an airborne infantry formation in the army national guard and has one battalion active under the rd airborne brigade combat team as part of the associated unit program aligning active and reserve units with one another for training and deployment,0
 layla london naughty gf love hard sex  cam movie  ,1
 wing rcaf was a unit of the royal canadian air force which served with the royal air force in europe during the second world war,0
 washington square is a  american silent romanticcomedy drama film directed by melville w brown written by harry o hoyt and walter anthony and starring jean hersholt alice joyce and george j lewis,0
 squadron named the arrows is a pakistan air force paf fighter squadron assigned to the no  multirole wing of the paf central air command,0
 carat gold tournament is a singleelimination tournament annually held by the german professional wrestling promotion westside xtreme wrestling wxw,0
uncle rich feeds amarna miller  thick cock ,1
dois pintos one guy two cocks ,1
cute free legal age teenager porn ,1
fucking my friend   cheating wife  hidden cam  ,1
bathroom fuck ,1
teen gets quivering orgasm while fucked hard ,1
busty blonde slut fucked by big black cock ,1
 were built by mak and abb between  and  for nederlandse spoorwegen,0
bangbros  slamming mandy muse  perfect butt hole  ass parade ,1
 year old teen in elevator fingering  striptease amateur porn ,1
backseat missionary with thick latina redhead ,1
 flying training school  fts is a former royal air force flying training school that operated between  and ,0
fucked ho face pissed  ,1
tattooed lesbian fingering tight dyke asshole ,1
pornfidelity anna de ville ass fucking multiple creampies ,1
cute babes kady  tina  talk dirty  lick each other in cheerful coupling  ,1
real homemade cock loving teen slut ,1
free legal age teenager porno clips ,1
 teams featured in the competition held in szczecin poland from  to  august ,0
   lokmanya tilak terminus pratapgarh udyognagri express is a superfast express train belonging to indian railways  central railway zone that runs between lokmanya tilak terminus and pratapgarh in india,0
th street is a bilevel express station on the ind eighth avenue and concourse lines of the new york city subway located at the intersection of th street and st nicholas avenue in harlem and hamilton heights manhattan,0
pmv   coming ,1
 songs were submitted to svt for the competition,0
 instrumentals was released on june  ,0
dimecityxxxcom wshh silk aka nikki cums while riding ,1
 is a studio album by the japanese noise musician merzbow,0
don whoe fucks nina rivera hard ,1
 volumes were released on the clef records label,0
dick flashing  real aunt ,1
red used panty in my wet  tiny pussy fingering   real intense orgasm ,1
 a touchdown is a  american comedy film directed by james p hogan written by delmer daves and starring joe e brown martha raye eric blore susan hayward john hartley and joyce mathews,0
milf mature have big boobs upornxxcom ,1
mamacitaz  tina kay francys belle  moisex uk milf takes cock   roof while  bff is filming ,1
 really want  jerk your big hard cock ,1
beauty is creating lusty waves with  naughty jock riding ,1
butanediol colloquially known as bd is the organic compound with the formula hochchchchoh,0
th arrondissement is an arrondissement in the littoral department of benin,0
 fucks every guy in  room ,1
 are wellknown enrico macias hits and two are special new songs for the album ces etrangers a new song written for enrico macias album by bruno maman and sang asa duo with erico macias lalgerie a song by serge lama that enrico macias chose to sing as a duo with the author as a tribute to his native country algeria,0
 squadron raf existed briefly as a day bomber unit in world war i but it never became operational,0
 cl is approximately  us teaspoon,0
 fans attended the contest on november    ten years and a day after president kennedy died in a stadium named after him,0
 is debut studio album recorded by american dance duo her majesty  the wolves,0
anal sex for busty milf alanna ackerman ,1
 designated by number  on the list of wright is a syriac manuscript of the new testament on parchment according to the peshitta version,0
 mile lake is a small lake located to the nearby town of  mile house,0
 teams qualified for the event at the beijing olympics host china plus the top  teams at the th outdoor archery world championship held in leipzig germany and one other noc that qualified three athletes for the games,0
 walbeck provisional designation  uo is a carbonaceous asteroid from the central region of the asteroid belt approximately  kilometers in diameter,0
put my cock in my little indian sister ,1
 grand concourse is a cooperative apartment building located in the concourse neighborhood of the bronx new york city,0
realitykings  hot bush  annika eve mick blue  annikas bush ,1
teen horny girl hannah reese for money agree  bang  cam   ,1
 scholarships are awarded to students who pass in stage examination of which  are for the general category and  for the reserved category,0
monsters cock in  asshole ,1
great blow job  hottie ,1
assmouth  anal pain  destruction for skinny masochist ,1
naked beauty massage ,1
tt mexican teen handjob ,1
jessie lee shakes  wet ass  bouncing big tits this tattooed beauty is all oiled up  waiting for  huge cock  fuck  hungry pussy ,1
anjelica horny masturbation  pussy orgasm ,1
 agnesi provisional designation  ua is a stony eunomia asteroid from the middle region of the asteroid belt approximately  kilometers in diameter,0
adorable blonde teen in naughty piss video ,1
anal penetration for honey lauren phillips ,1
 students attend this school,0
juliareavesproductions  blow job   scene   video  boobs movies group teens cumshot ,1
wam pov deep throat slut ,1
babes  in white lace natalia starr ,1
 competitors  men and  women took part in  events in  sports,0
finger your clit until you cum like  good cumslut  bunnieandthedude ,1
 was originally kqlv and had aired emfs klove format,0
personal assistant fuck boss  husband ,1
 is suicidal tendencies first album containing original material since s free your soul and save my mind although they had rerecorded their older material and released a handful of new songs on friends  family vol   year of the cycos  and no mercy foolthe suicidal family ,0
bpg is also a precursor to bisphosphoglycerate which in turn is a reaction intermediate in the glycolytic pathway,0
 is the debut studio album by the rock band ulysses,0
tight amateur in need  some cash ,1
 hakone provisional designation  rj is a eunomian asteroid from the central regions of the asteroid belt approximately  kilometers in diameter,0
excellent spooning session ,1
naughty america real estate agent bunny colby does what it takes  close ,1
th indiana battery light artillery was an artillery battery that served in the union army during the american civil war,0
cougar kira silver gives up  pussy   lucky young man ,1
femdom cuckold humiliation pov ,1
columbian teen receives  good fuck  nacho with cumshot   face ,1
flexible yoga babe izzy bell bounces  bbc ,1
leche  latin ebony takes it fat  hard ,1
dads  their sons sucking dick ,1
asian girl first massage session ,1
babe fucked in group in public restroom ,1
publick pickups  zeus kinsley karter  fucking fierce kinsley  mofos ,1
 inman street is a historic house located in cambridge massachusetts,0
 ll never fuck your tiny dick ,1
first time lesbian experience between highschool friends in my hotel room ,1
 archers entered the competition,0
 not out is a  hindilanguage indian comedydrama film directed by umesh shukla and starring amitabh bachchan and rishi kapoor in the lead roles,0
cute brunette takes it at  bottom   ass ,1
eroticax britney amber romantic afternoon sex ,1
 battalion was a motorized infantry unit of the south african army,0
  allowed morphing between  pictures and creating a movie of the morph   allowed morphing between pictures and video   new curve feature windows version flipbook creatorgryphon softwares morph  was the original awardwinning windowsmac morphing software that was used extensively in the movies eg bram stokers dracula robin hood men in tights and tv commercials and featured on the cover of time magazine twice,0
 herculis  her is a star in the constellation hercules,0
soccer mom takes your load in any way  can ,1
naomi west newbie blow job sucks out  cum ,1
 songs were submitted to svt for the competition,0
th street marks the southern terminus of manhattans grid system,0
tight teen riding big black ombfun vibrator creamy cum ,1
  is the uk telephone number for a us owned directory enquiries provider,0
 designated by number  on the list of wright is a syriac manuscript of the new testament according to the peshitta version on parchment,0
 and  am west yorkshire was a temporary name used for the am sister station of the pulse of west yorkshire,0
 clubs play  games and are awarded  points per win and  point per draw,0
hot brunette shows  nice tits   beach ,1
pretty teen asian live  cam new ,1
big ass alysha rylee fucks  huge black dick ,1
your wife can  suck your cock this good  sub en ,1
cute latina teen first porno ,1
 squadron raf was a royal air force squadron formed to be a bomber unit in world war i and reformed as a fighter unit in world war ii,0
 bengali hindus were killed in the massacre,0
skinny guy anal with cucumber ,1
stepsister craves for  big pulsating schlong ,1
german hairy mature extreme fisted ,1
milf dillan lauren gives  sloppy blow jay ,1
 competitors from finland won  medals including  gold  silver and  bronze and finished th in the medal table,0
hot milf masturbating  porn gets  cum shower  huge cumshot  yummycouple ,1
wheel  pain  ,1
 regiment royal logistic corps is a reserve regiment of the british armys royal logistic corps,0
asian with red gloves jacks  fuck big black dick ,1
tetrabromobenzene is an important metabolite of the completely brominated hexabromobenzene used as a flame retardant in the animal organism with liverdamaging properties,0
big black cock cums  ghetto girls face ,1
 of his  matches were played for oxford the remainder being for various gentlemen sides,0
 singaporeans were sent to compete in six sports archery athletics boccia equestrian sailing and swimming,0
eating  best friends pussy  orgasm ,1
 ways to beat the draft is a satirical vietnam war protest pamphlet written in  by robert bashlow and tuli kupferberg,0
 on the air charts upon release and their second fulllength album hate debuted at no,0
s was a decade of the julian calendar which began on january   and ended on december  ,0
young mom with big milk boobs fingering  pussy ,1
hijab turkish bitch cam  hornyslutcamscom ,1
brazzers  big tits at work  interoffice intercourse scene starring monique alexander  danny ,1
 received its charter to meet in dysart fife,0
extreme hard fisting my wufe ,1
tattooed teen amateur cocksucking old man ,1
fuck my ass  says   o ,1
 competitors  men and  women took part in  events in  sports,0
hot blonde trains  perfect body with blowjob  fuck session ,1
bbc trainer  black cock whore trainer ii emma nice  ls subliminal av edit ,1
s ribosomal rna or s rrna is the component of the s small subunit of a prokaryotic ribosome that binds to the shinedalgarno sequence,0
 tons of kernels were exported during ,0
rf part of inmagine group is a stock content agency founded in  which sells royaltyfree images,0
 istarbattalion has a complement of little over  personnel and is stationed at legerplaats bij oldebroek and the lieutenant kolonel tonnet kazerne in t harde in the veluwe area of the netherlands,0
gorgeous teen gang bang by stepbrothers ,1
inch big black cock   gilf webcam show ,1
 dalmatians is a  american crime family comedy film directed by kevin lima in his liveaction directorial debut and produced by edward s feldman and walt disney pictures,0
 other teams will also receive cash grants for their donors and the team at the end of the season,0
old lady makes love with  bf ,1
 naval air squadron  nas was a naval air squadron of the royal navys fleet air arm,0
sexual pov oral pleasure session ,1
 people live within the village,0
alina west tied up  is punished by master ,1
bthe briggses believed psalm  to have been written in the persian period after zerubbabel but before ezras reforms possibly by the same author as psalm ,0
hot girlfriend shared with stepdad ,1
  sexy wife megan rain cheats  fucks husbands bff while home alone ,1
 days of activism against genderbased violence is an international campaign to challenge violence against women and girls,0
ass traffic angelic hot blondie eurobabe gets anal ass fuck ,1
th new york infantry regiment was a regiment of infantry organized in new york state during the american civil war,0
 of the  teams taking part were the same as in  but two lowest ranked european teams sweden and russia were replaced by teams from asia japan and oceania samoa,0
 days is a adventure casual indie video game developed by german studio house of tales and published by thq nordic,0
horny wife danica dillon fucking ,1
 candidates  including  women  contested  seats,0
culioneros  big booty latina fucks in public ,1
 salamanders were built and used in the royal air force as the alvis salamanderpyrene mark  and the royal canadian air force,0
 athletes in  sports will represent serbia,0
fitness babe makes me cum in  panties  yoga pants ,1
peehole fuck session for bonded sub ,1
 competitors from argentina won  medals including  gold  silver and  bronze and finished th in the medal table,0
 aster provisional designation  bj is a bright asteroid from the inner regions of the asteroid belt approximately  kilometers in diameter,0
 life callsign ram is a christian radio station in adelaide south australia,0
 tank wagons were derailed and chemicals spilled,0
 am and  fm have separate program schedules,0
th tejano music awards were held in ,0
college girls boobs so ,1
th street was a local station on the demolished irt ninth avenue line,0
 alloy is also sometimes used for the manufacture of heat sinks since it has a higher thermal conductivity than other alloys,0
