 homo djs began as a side project to release outtakes from ministrys the land of rape and honey,0
enjoying  little pissplay in  morning ,1
cum catcher ,1
analacrobats  inked babe badlittlegrrl asshole stretching ,1
hidden camera husband cheats with my stepsister ,1
 different teams and  different drivers competed,0
yr old fuckin  step mom  big booty friends comic ,1
 competitors  men and  women took part in  events,0
hot girl caught in forest  rough hard fucked full fuck video xxxgirlcom ,1
 uncensored  school girl have sex ,1
 of the  songs on the album have been licensed internationally to various films advertisements and tv shows as well as independent films and nonprofit groups,0
 broadway formerly the mony building or mutual of new york building is a story building in midtown manhattan in new york city which is owned by equity office properties,0
milf takes  big fat cock  camera ,1
 or xi squadron sometimes featuring a f to represent its historic fighter role no f or xif squadron is one of the oldest fighter squadrons of the royal air force continuing the traditions established by the similarly numbered royal flying corps squadron established in ,0
 is the seventh and last release for the italian hardcore punk band negazione,0
 memories is the thirtyfirst studio album of bobby vinton released in  by the canadian label ahed,0
 former players were selected in the  draft and the mohawks currently have  former players playing professional baseball,0
cute legal age teenager porn pics ,1
cabs is a taxi network service provider nsp operating in adelaide brisbane hobart melbourne newcastle and sydney,0
hot daughter with big ass riding  daddy  dick ,1
public pissing in each others mouths ,1
hot russian blonde daniella margot assfucked  double penetraded by  guys ,1
adorable woman dance  crakcamcom  sexy live chat  super hot porn ,1
secretary gets  cumshots in pantyhose  business bitch ,1
mature man makes cute teen jerk off  cock ,1
curvy oiled latina loves fat cock in  mouth ,1
 in mens singles as of july   and reached his careerhigh singles ranking of world no  on november  ,0
ashton pierce sucking  cock ,1
 teams participated in the regular season and the rapides de lasalle won the league title,0
nathalie shows  big clit masturbation ,1
rough threesome fuck orgy  public stage ,1
bisdimethylarsinobenzene diars is the organoarsenic compound with the formula chasch,0
pmueller also known as mueller  is a periodic comet in the solar system,0
alisha rage in  scene by asstrafficcom trailer ,1
 one hundred and fortysix is the natural number following  and preceding ,0
 was the nd english cricket season since the earliest known important match was played,0
dirty flix   art  making love jay dee teen porn ,1
 was established on may  ,0
 fencers from  nations competed,0
horny soldiers bang sexy corporal sophie lynx  pussy  ass ,1
 laugier provisional designation  eb is an asteroid from the outer region of the asteroid belt approximately  kilometers in diameter,0
schoolgirl with bigtits fucked in parents bed ,1
 warmup matches were played between  and  march featuring all  teams,0
cock out for g  in law ,1
 west th street also known as the steinway tower is a supertall residential project by developers jds development group and property markets group in west midtown and hells kitchen in manhattan new york city,0
 squadron is a fighter squadron of the indian air force,0
ultrasilent fucking machine vs hyperrealistic sex doll part   wwwdolltrainingcom ,1
cam session    red shorts fishnet juicy booty part  ,1
 cyclists from  nations competed,0
 competitors  men and  woman took part in  events in  sports,0
 picks up him   street  fucks ,1
lots  oral service  blondes  massing group sex at night club ,1
 different teams  different drivers competed,0
stroke your cock  cum all over my ass ,1
 piscium a distant star located over  lightyears away,0
father daughter homemade  kinkfreetubecom ,1
 see oregon highways and routes,0
   barmer yesvantpur ac express is an express train belonging to indian railways  north western railway zone that runs between barmer  yesvantpur junction in india,0
amazon babe deepthroats  fucks huge black cock ,1
raw casting desperate amateurs compilation hot moms nasty white wives need money now pay bills ,1
 are farmers while an additional  receives their livelihood from raising livestock,0
ebony fuck machine gets vaginal creampie after analsex ,1
 east cayuga street is a historic house located at the address of the same name in moravia cayuga county new york,0
 published by the elmfield press and the fifth through seventh as the worlds best sf nos,0
desi girl sex with  bf ,1
 teams competed in the  season,0
 proof is a  independently produced american thriller written and directed by jeremy horton,0
th avenue is a regional transportation district rtd light rail station on the r line in aurora colorado,0
 is a rural municipality in the canadian province of saskatchewan,0
 cyclists participated in the contest,0
 athletes competed in  different sports,0
sasha knoxsex slavesm free hardcore hd porn hardcore  abuserporncom ,1
 years of portuguese supremacy in the region ended with the fall of the city and fortress of malacca almost  years later in ,0
 group of the royal air force is a disbanded group,0
 m runner tirunesh dibaba ran the second fastest  meters of all time setting an olympic record of  minutes  seconds,0
 competitors  men and  women took part in  events in  sports,0
how olivia grace lost  virginity ,1
rocco  best teens full movie ,1
threesome  kira thorn  girlsrimming  nataly gold ,1
my latina freak ,1
my best friends fiancee ,1
horny chinese girlfriend blowjob doggy cowgirl foot sex more asian porn in avideo asiancom ,1
summerbluexo amazing blowjob girl ,1
 was the nd english cricket season since the earliest known important match was played,0
anal gape compilation ,1
 doctor is in  butt trailer ,1
sexy milf  teen fucked by one bigcock ,1
slim teen fucks big cock in public for cash ,1
booty teenager rides bbc ,1
performer  male fantasies  year ,1
 competitors  men and  women took part in  events in  sports,0
hot busty alena croft wanted  dick deep in  asshole  brazzers ,1
alexa caliente spicy mexican skank getting  taco stuffed ,1
cumshot surprise  this sperm bath had  have been in  mouth ,1
terry married gets filmed while cheating   husband ,1
 are more simply constructed from the orthoplex,0
 of the students are minorities primarily african american below the state average of ,0
hardcore coed cant get enough piss ,1
 want  jerk your cock until you balls are empty joi ,1
married liar assfucked  inseminated ,1
rough fuck butt plug tail pov creampie ,1
bigtit babe fists chubby matures pussy ,1
 sites were originally constructed as a part of the classic bullseye program,0
jay  pov  step daughter gem has vice grip super tight pussy  makes daddy cum twice ,1
my girl friends mom is sexy as hell ,1
daughter seduce father ,1
skinny young perfect breasts blonde slut fucked hard by boyfriends big cock ,1
thin big titty pornstar courtney cumz blows  fan untill all sees  cumshot ,1
lonely blonde playing with herself in pantyhose ,1
clean living thai slum bird has bottom pentrated ,1
married lesbian couple fucking ,1
rocco  perverted secretaries scene  kris  foxx ,1
carmella wild girl ,1
lucy tyler  huge cock ,1
xhamstercom   year old blond fucked  hidden cam ,1
 orionis is a class fiv early ftype subgiant star in the constellation orion,0
licked juicy pussy  multiple orgasms expertly eating pussy ,1
 fucked my sexy  horny friend  busty mom while    ,1
s up is a multilevel speed game using one deck of playing cards,0
niche parade  paid blowjobs spycam compilation ,1
dirty talking mommy roleplay pov ,1
 westferry circus is an office building located on the upper level of westferry circus canary wharf development in london united kingdom,0
buff college football jock gives hawaiian redbone babe best fuck ever ,1
 competitors  men and  women took part in  events in  sports,0
 swimmers were entered in the event of which  swam,0
 seats were uncontested,0
public handjob cum  pussy   stranger in  dressing room in stocking xsanyany ,1
free wicked legal age teenager porn ,1
th street oakland city center is an underground bay area rapid transit station located under broadway between th street and th street in downtown oakland next to the oakland city center,0
sexy ass indian desi babe lily sex ,1
 is the ninth studio album by american rapper ll cool j released on october   by def jam recordings,0
 quarry street is a historic house located at  quarry street in fall river massachusetts,0
adrien stone  first time sex ,1
th indiana battery light artillery was an artillery battery that served in the union army during the american civil war,0
 bullets is a fictional crime drama published by vertigo imprint of dc comics,0
fellatio examined with cumshot ,1
peculiar hottie gets sperm load   face swallowing all  ejaculate ,1
tight pussy wife fucked neighbor bigcock  private milf wife video new ,1
swinger couple has good sex ,1
 rod locomotives were purchased in all three remain,0
th floor records is a british subsidiarity record label of warner music uk founded in  by part owner christian tattersfield,0
lexington steele  amy anderssen with huge boobs ,1
sea  cock ,1
massage pleased ending ,1
public humiliation  sex ,1
pink pussy needs  cock ,1
anal addict austrian slut  rocco  huge dong ,1
hot hairy babes try licking  rimming in orgy ,1
 amphibian species have been registered in honduras which are grouped in  orders caecilians gymnophiona salamanders caudata and frogs and toads anura,0
 alexisrodrz provisional designation  jp is a stony asteroid from the central region of the asteroid belt approximately  kilometers in diameter,0
fingered pornstar facial ,1
 neediest cases is an annual charitable campaign jointly sponsored by the st louis postdispatch and the local chapter of the united way,0
 municipal council seats were open for election in  municipalities,0
all free  porn ,1
 photographs that changed the world is a book of photographs that are believed to have pushed towards a change accumulated by the editors of life in ,0
japanese boy every morning sex with  when theyre horny ,1
 competitors  men and  women took part in  events in  sports,0
 teams took part in the league with cska moscow winning the championship,0
old dude fucked young neighbor  wife ,1
unleashed sluts in action  ,1
 pipers is bottled in india and scotland and possibly elsewhere,0
big booty babe ass fuck big dildo  hot solo ,1
naked massage dailymotion ,1
ladies with pantyhose are in love with each other ,1
nowadays the society offers a variety of services relating to agriculture and veterinary science including public and professional events seminars and advice scholarships and a marketplace for countryside products,0
busty  horny arab cam girl ,1
play with my butt  cum inside my pink pussy ,1
 somalia provisional designation  nk is a stony background asteroid from the central regions of the asteroid belt approximately  kilometers in diameter,0
chanel grey deepthroats yoga instructors cock fucked hard  squirts ,1
th air land regiment is the australian armys only groundbased air defense unit,0
 teams entered the competition,0
ever so passionate blow jobs n money shots sync   beethoven  moonlight sonata ,1
 geertruida provisional designation  hd is a carbonaceous background asteroid from the inner regions of the asteroid belt approximately  kilometers in diameter,0
fetish teen cunt fisted ,1
teen babe riding cock ,1
 was added to the national register of historic places on december  ,0
hot chubby girl with great ass  hairy pussy  cam  camgirlsuntamedcom ,1
huge bbc destroys petite teen free young porn ,1
 was the th english cricket season since the earliest known important match was played,0
 years later he was promoted to become a deputy and joined the national association of colliery overmen deputies and shotfirers nacods,0
ass fingering cuties  angie moon dolce vita ,1
 precinct is located in menard county illinois united states,0
 kasan provisional designation  wc is a stony asteroid and sizable marscrosser on an eccentric orbit from the asteroid belt approximately  kilometers in diameter,0
really thick cock in  besties ,1
 american song book is an album by italian singer mina released in ,0
d is one of four reserves of the batchewana first nation of ojibways in algoma district in northeastern ontario canada,0
best milf sucking ever free indian porn video mobile ,1
thick latina rose monroe fucks with  bbc ,1
 athletes from  nations took part in the two races,0
 nations of  cyclists each participated in the contest,0
 national teams from across europe composed of women aged  and under will compete in the tournament,0
becoming  cuck boyfriend pegging strapon pussy eating cuckold ,1
 specimens of burgessia are known from the greater phyllopod bed where they comprise  of the community,0
 edmondson provisional designation  fn is a dark background asteroid from the outer regions of the asteroid belt approximately  kilometers in diameter,0
young bhabhi in hotel room ,1
husband shows off in front   friend ,1
german blonde free hardcore porn video ,1
 risky outdoor public squirting videos ,1
 squadron was a royal australian air force raaf heavy bomber squadron of world war ii,0
 is the natural number following  and preceding ,0
couple starts out their fuck at  beach ,1
tiny asshole fucked hard  empera renato ,1
 is a book by rebecca larson published in ,0
fake taxi russian hairy pussy natural tits ,1
teen step sister joseline kelly hot pov fuck with stepbrother ,1
 magnitude  earthquakes were recorded with the largest of those striking greece in the summer,0
 competitors  men and  women took part in  events in  sports,0
nd pennsylvania house of representatives district is located in southeastern pennsylvania and has been represented since  by michael schlossberg,0
amazing young brunette gets double penetration   beach ,1
demure playgirl is moaning wildly as stud licks  babe pot ,1
 rounds played the reading festival in ,0
hot step sister makes me cum in  panties  pull them up ,1
british milf clara hewitt fingers  hairy cunt ,1
chinese girl receives  long  painful paddling in  hotel ,1
cutie with pigtails is home alone  horny ,1
young daughter kendra lynn uses  teen mouth  pussy  impress  step father ,1
hidden massage playing with clients pussy  camadultxxxcom ,1
 originally aired on abc on october   and according to nielsen media research was watched by  million viewers within a week of its release,0
 weeks with geeks is a  documentary film about the development of fog creek copilot a remote assistance software tool,0
th our gang short that was released,0
st regiment of foot was an infantry regiment of the british army formed in  and disbanded in ,0
 south second street also known as the jacob frank carriage shop is a historic home located in newport pennsylvania,0
 years later in  it was given an english dub produced by ocean productions and recorded at blue water studios,0
 synthetic is an ep by american punk rock band the honor system,0
gorgeous young brunette hard analized  double penetrated in threeway outdoor ,1
 hours is the debut ep by american punk rock band green day,0
proxy paige  maddy oreilly anal sex ,1
 teams participated in the league and hpk hameenlinna won the championship,0
niche parade  what are you doing that  not normal flashingcock ,1
 nights of christmas is the first holiday and fourteenth studio album by american rb singer r kelly,0
leaked homemade filipina porn sex tape ,1
asstraffic tiny teen does hard anal ,1
 dreams became a minor hit in belgium where it reached toptwenty on the flanders ultratip chart,0
  eastern orthodox church calendar  may  all fixed commemorations below celebrated on may  by orthodox churches on the old calendar,0
share bed ,1
bdsm sub deepthroats black cock ,1
my girl enjoys my dick making me horny ,1
passionate couple pussy eating  pounding creampie ,1
 teams featured in the competition held in vukovar and vinkovci croatia from  to  august ,0
brother  sister sex video first time  watchhdpornonline ,1
kinky piano teacher florane russel double penetrated with dick  sex toy gp ,1
 star fm manila owned and operated by bombo radyo philippines,0
pounded by neighbours big black cock ,1
horny blonde milf loves this young cock ,1
 cyclists from  countries participated in the contest,0
 march  at north beaches of blackdog sapper leslie alfred whitney  royal engineers age  when a toadstool he was arming detonated,0
big brother can  stop spying  little sister  hailey little  family therapy ,1
 oaks mall sometimes written out as one hundred oaks mall is a shopping mall located three miles south of downtown nashville tennessee along interstate  and tennessee state route ,0
videoz  fucking welcome jessy nikea teen porn ,1
 teams entered the competition and portugal defeated spain in the final to win the competition for the second time,0
art  blow job ,1
whore fucks  guys  ,1
playful secretary feralberryy seduced  boss ,1
 nyanza provisional designation  jh is a dark asteroid from the background population of the outer asteroid belt approximately  kilometers in diameter,0
 clubs currently participate in the north cork championship,0
real puerto rican couple jolla  mark make love in hotel balcony because they want people  see them fuck ,1
straight blowjob ,1
 athletes all men competed in  events in  sports,0
 years after the last studio album chinese democracy was released in november  featuring contributions from most band members since ,0
prolapse queen linda sweet licks cum  timea  asshole after deep double anal ,1
fake boobed milf shoplifter sarah vandella fucked in lovely poses ,1
 of them were confirmed by northern blot,0
you can do get away with shop lifting if you re  hot milf jessica ryan ,1
when san marino hosted the  games of the small states of europe in serravalle mularoni managed to defend titles in the  m freestyle  and  m freestyle ,0
femdom dominica phoenix rewards  submissive with  face ride ,1
liv revamped stretched  teen pussy  top  step dad ,1
 year old lesbians share cock  remi jones  hazel heart  perfect girlfriend ,1
 is the tenth studio album from the stranglers and was the last to feature guitaristlead singer hugh cornwell,0
 northumberland mla atkinson tighe resigned in may ,0
 gardens live is a sony music compilation of songs performed by american singersongwriter billy joel during a former record run of twelve soldout concerts at madison square garden in new york city in early ,0
ambush creampie first anal casting ,1
bangbros  pawg keisha grey does anal  monsters  cock with our buddy stallion ,1
step sister gets punished   for taking dads credit card part  ,1
h friend lets me fuck  in exchange for homework ,1
 of these top floors were approved for use by private sector offices and the top  floors have floorto ceiling windows,0
 squadron of the royal air force currently operates the beechcraft shadow r a modified beechcraft super king air in the intelligence surveillance target acquisition and reconnaissance istar role from raf waddington,0
daisy ridley nude star wars actress ,1
rough anal fuck  cum in gaping ass with leigh raven ,1
bangladeshi couple erotic sex ,1
th infantry division pakistan where he was transferred command by the then goc general raheel sharif ,0
huntk horny man decided  fuck  ex gf who is married already ,1
 years into bayinnaungs reign his second attempt at invasion of siam and first as king succeeded after an extensive siege of the city of ayutthaya,0
 cethe site was listed on the national register of historic places in  for its information potential,0
 is an oil fired yard switcher,0
on september   carter released the rb womanizingthemed rebirth via itunes and amazon,0
carnal  erotic pecker engulfing ,1
chinese gay couple facial cumshot ,1
 clvi was a leap year starting on wednesday link will display the full calendar of the julian calendar,0
 fifth avenue informally known as the   is a luxury residential housing cooperative in the upper east side of manhattan new york city,0
 teams participated in the league and hc alleghe won the championship by defeating hc bozen in the final,0
nubilefilms  office slut fucked till  squirts ,1
bnb jessica right tube  ,1
college girl samantha plays  orgasm for teacher ,1
professor gaia lets  big bbc cum   tits ,1
 is an emergency number for contacting the fire brigade ambulance and police in all  countries of the european union,0
 swallow was a british experimental aircraft designed by john carver meadows frost in october ,0
riley reyes black cock anal  gloryhole ,1
 fighters from  european countries participated in the competition,0
 songs is the second album by american singersongwriter randy newman released in april  by reprise records,0
 teams participated in the competition held in latvia from  to  july ,0
two hottest lesbian play with pissing ,1
diphenylethylene is an aromatic hydrocarbon with chemical formula ch,0
black swan jenna foxx blows  white cock  gets cum ,1
swinger wife chrissy curves anal cuckold interracial ,1
 call sign cbr is a commercial radio station in canberra australia and is owned by the australian radio network and southern cross austereo,0
beauty has sex with stranger ,1
 calcium chlorideh is used in a number of military applications notably underwater munitions eg naval mines depth charges and torpedoes where it has generally replaced torpex being less shock sensitive and having more stable storage characteristics,0
observe couple  juicy titty fuck  watch krystal swift  big boobs shake ,1
butylene carbonate is a polar aprotic solvent which has been considered for electric battery applications as a cheaper alternative to ionic liquids and many other uses,0
bigbooty milf analfucked in interracial trio ,1
mixed wrestling facesitting headscissor humiliation ,1
q deletion syndrome is a rare genetic disease caused by the deletion of some or all of the large arm of human chromosome ,0
busty teen kseniya has anal sex at  office ,1
 november  presided over by ebbo archbishop of rheims,0
 also known as aedpa is an act of the united states congress signed into law on april  ,0
 is a municipal district in northwestern alberta canada,0
     blowjob  doggy fuck in snake dress ,1
pov fucking spicy latina teen for cash ,1
 squadron saaf was a south african air force squadron formed in  to operate the south africanfrench cactus surfacetoair missile systems in an air defense role,0
exotic arab milf fuck ,1
 competitors  men and  women took part in  events in  sports,0
 upping st a pun on  downing st the residence and office of the prime minister of the united kingdom is the second album by big audio dynamite led by former clash guitarist and songwriter mick jones,0
teen fingered  pussylicked by stepmom ,1
 of the plants habitat is potential territory for oil and mineral mining,0
 seats were uncontested,0
 days is the fourth studio album by american rock band tool,0
 years a slave made black reel awards history by winning  awards including outstanding motion picture,0
 horses portrayed the black across the three countries,0
 candidates contested for the  constituencies in the assembly,0
behind  scenes with  skinny stripper slut outdoor ,1
 mertona provisional designation  ba is an asteroid from the central region of the asteroid belt approximately  kilometers in diameter,0
 fuck my horny aunt with  huge ass ,1
 was completed in  the year before his death,0
 film is a  dutch film by arthur dreifuss starring linda christian eric schneider and bob de lange,0
povd  big breasted mia scarlett pleases  man in pov ,1
if you be  slut with me  won  tell your  you snuck out naiomi mae ,1
quiet sweety ass fuck thai ,1
 of them shown as red in list are currently under construction,0
big ass sexy blonde katia gets fucked for money ,1
 employees and ongoing work at the site were transferred to samlesbury aerodrome,0
brazzers  shes gonna squirt  wet spots scene starring bridgette   will powers ,1
fake hostel sneaky fuck   bottom bunk while big tits masturbates   top ,1
 and the blackstar score are both currently on their first chapters,0
mia khalifa  big tits arab slow motion blowjob ,1
ay streatz  suck up  click music video ,1
 referral laboratories notified by fssai  stateut laboratories located throughout india and  laboratories are nabl accredited private laboratories notified by fssai,0
pov cuckold watch your wife fucked ,1
 athletes from  countries competed,0
  gospel was an inspirational version of the topten video countdown show   park that aired sundays on bet,0
white teen in tight jeans with  nice ass ,1
amateur friend  mom riding long dick  seductivegirlcamscom ,1
flower  blows me ,1
 as prize for winning the title,0
dp fucked beauty sprayed with warm cum ,1
 vehicles were built the majority were bought by tees  district now arriva north east grampian regional transport now first aberdeen eastern scottish now first scotland east leicester citybus now first leicester and east yorkshire motor services,0
sexy teen in stocking spreads for fisting ,1
celebrity sex scene  behind compilation ,1
go was released on august  ,0
 archers took part in the mens recurve qualification round with no more than  from each country and the  teams of  archers with the highest cumulative totals out of a possible  qualified for the round knockout round drawn according to their qualification round scores,0
th new york volunteer infantry was an infantry regiment in the union army during the american civil war,0
 teams participated in the tournament and  teams withdrew,0
seductive japanese chick takes two fat dicks in  holes ,1
 to  in an attempt to dissuade him from joining the dominican order,0
 test centuries have been scored in this ground up to  december ,0
  february  and was created by jim shooter and curt swan,0
