norpseurotin a is an alkaloid and a bioactive metabolite of aspergillus featuring an oxaspirolactam core,0
th maine volunteer infantry regiment was an infantry regiment that served in the union army during the american civil war,0
 delegates were tied to the results of the primary with the remainder being unelected superdelegates not pledged to any candidate,0
lil olivia rides cock cum in mouth ,1
  august  and was created by denny oneil and dick dillin,0
ginger pigtail teen rides cock  top ,1
 no  g  by luigi boccherini was written in  and published in ,0
 monthly meetings take place in shrewsbury the county town from september to june usually with a speaker and a fair is held on the first saturday in june,0
horny  futa girls start ass fucking in public at  museum ,1
 of the  states excluding the baltic states initially formed the cis and most joined csto while the baltic states focused on european union and nato membership,0
hot flexible girl fucked in all positions ,1
 whore can have sex anywhere ,1
 real radio xs continued to operate under that name until a relaunch as xs manchester in ,0
 squadron was a royal australian air force maritime patrol squadron of world war ii,0
 years old sri kannika parameshwari schools are located in kombai where the famous music director ilaiyaraaja studied,0
petite teen girl gets  pussy eaten out until  cums all over  face ,1
 contestants vied for the crown,0
 competitors  men and  women took part in  events in  sports,0
 north wilcox avenue is the location of a company known as hollywood mail which rents hundreds of physical addresses for those who wish to make it appear that their business is actually located at that address,0
 movies lists but there are many others and several entries with dozens of positive reviews which are considered surprising to some experts,0
 riders competed,0
young anal lover roxy raye gets  adorable butthole tongue fucked ,1
petite teen roughfucked at  casting ,1
pretty hot sweetheart gets punished ,1
king kreme loves fucking this bbw fat pussy white freak ,1
horny ukrainian babe gets  ass fucked hard  shows off  perfect gape featuring jessica night ,1
 eunomia is a very large asteroid in the inner asteroid belt,0
 february  the secretarygeneral announced the formation of a new highlevel panel to explore how the united nations system could work more coherently and effectively across the world in the areas of development humanitarian assistance and the environment,0
 november the security council noted the continuing peace process in tajikistan and the general observance of the ceasefire by the tajik government and united tajik opposition uto,0
 heckmann provisional designation  tg is a raretype nysian asteroid from the inner regions of the asteroid belt approximately  kilometers in diameter,0
black booty teen secretly rides dildo in  park ,1
 homo djs was a side project of american industrial rock band ministry,0
top oriental porn star ,1
 babur besieged kabul and took the city from the arghuns under mukim beg arghun to become the new king of kabul and ghazni regions,0
young andi rye loves rough fucking ,1
mature woman tries anal sex ,1
asian masseuse sitting  guy face sucking  cock fucked in doggy   mattr ,1
hot creampie compilation  only japanese pussy  more at javhdnet ,1
 rounds is a british rock band formed by atticus ross and singer claudia sarne who are married,0
 countries participated in the  championships finland kazakhstan norway russia sweden the united states group a and belarus canada hungary latvia and the netherlands group b,0
village virgin banged in  local lodge  hindi sex video ,1
wicked things are always fun when spiced up with kinks ,1
 questions are posted every month,0
schoolgirl fucked   mothers bed ,1
 steinmetz provisional designation  we is a stony asteroid from the central region of the asteroid belt approximately  kilometers in diameter,0
 passengers were killed and  injured in the disaster,0
bbc orgasmic bliss ,1
airhostess fucked hardcore by lover in doggy style  indian porn videosmp ,1
 on the uk albums chart making it the bands highest charting album to date,0
 karol bagh was an indian television drama series that aired on zee tv set in the karol bagh area of delhi,0
vixen young asian student has passionate sex with neighbor ,1
trembling orgasm ,1
fellucia blow me ,1
mature  hairy pussy ,1
 sailors on  boats from  nation competed,0
free hd fuckfest porn ,1
realitykings  money talks  esmi lee kaci lynn tony rubino  legs up ,1
 nations participated following the late withdrawal of both nauru and denmark and the introduction of spain,0
 luda provisional designation  qf is a stony asteroid from the middle regions of the asteroid belt approximately  kilometers in diameter,0
 squadron saaf is a squadron of the south african air force,0
trikepatrol fishnet filipina tells foreign big dick  cum into toilet ,1
 in the  afl draft and was mainly a defender or midfielder,0
inked up submissive gets throated ,1
 epopea lirica damerica is an opera in four acts by antonio braga,0
 is the national dialing code for sheffield in the united kingdom,0
my sick brother records me  fingers my tight pussy ,1
  before making its first appearance in the following issue,0
cherry kiss in messy anal scene by ass traffic ,1
 is a studio album by american rapper mac lethal,0
 of the  schools are located outside of the district from butler clearfield forest venango and warren counties but compete in district  sports competitions,0
latina girl prada xxx has nice pair  tits  ass ch ,1
elastic ass fisting ,1
liz heaven fucks in our boxtruck in  public place ,1
 kilometers in length and  in breadth its area of  hectares makes it the largest natural freshwater loch in lothian,0
 media organizations were accredited to cover the proceedings involving some  individual journalists,0
th armored brigade combat team is a brigade combat team of the mississippi army national guard,0
 of his most celebrated tales  is a collection of short stories by ray bradbury,0
 battle of fort albany was one of the anglofrench conflicts on hudson bay,0
 competitors  men and  women took part in  events in  sports,0
your stepmother knows you want  have sex with    is happy  help pov ,1
chubby coed ivy lace is swallowing  stiff cock ,1
   kanpur anwarganj gorakhpur chauri chaura express is a express train belonging to indian railways  north eastern railway zone that runs between kanpur anwarganj  gorakhpur junction in india,0
cumming  young pussy closeup ,1
 albums were number one on the mega album top  the official albums record chart of the netherlands in ,0
amazing hot babe dolly little fucking it hard ,1
petite asian without panties banging in kitchen ,1
stone is the daughter church of kentwood community church,0
th howitzer battery joined the brigade in may ,0
 sailors on  boats from  nations entered,0
 was the rd english cricket season since the earliest known important match was played,0
less nurse  enema spanking strapon stop jerking off visit realonecom ,1
 syriac manuscript of the new testament according to the peshitta version on parchment,0
 ca  bc as hnw and in his deir elbahari tomb as hnnw,0
black payback   brunette throat ,1
th has garnered acclaim from film critics,0
blackedcom foursome fuck with two hot brunettes ,1
 arcadia provisional designation  qv is a stony agnia asteroid from the central regions of the asteroid belt approximately  kilometers  miles in diameter,0
 collegiate teams will be placed under the first division and divided into two groups for the elimination round while the remaining  teams played in the second division,0
young legal age teenager hardcore clips ,1
smoking hot red head  free register wwwmyteenscamtk ,1
 amps is a  actionadventure puzzle platform game developed by brandon brizzi,0
best blowjob compilation new release  deepthroath blowjob swallow vigo ch  porn stars collection ,1
gorgeous wife gets  great doggy pounding ,1
beta is a protein that in humans is encoded by the appl gene,0
fucking  sucking with  best  new sensations compilation ,1
 students attend shadow mountain as of ,0
 helicopter unit tankbusters is a helicopter unit and is equipped with hal chetak and based at jodhpur air force station,0
natural huge tits brunette rough fucked ,1
 harley street is a grade ii listed terraced town house in harley street in the city of westminster london,0
 albion provisional designation  qb was the first transneptunian object to be discovered after pluto and charon,0
evilangel bonnie rotten anal threesome ,1
 coppernicus provisional designation  la is a stony background asteroid from the inner regions of the asteroid belt approximately  kilometers in diameter,0
journos has recently been featured on a time magazine article whose title is meet the man transforming journalism in turkey,0
iggy azalea full sex tape leaked ,1
   intercity express is a express train belonging to indian railways southern railway zone that runs between ernakulam junction and kannur in india,0
horny dirty talking milf taz masturbates pierced vagina ,1
 otherwise known as mummy  or mummy no  was an ancient egyptian female mummy,0
 archers entered the competition,0
more dick than lotus can handle ,1
real pulicsex slut blasted with cum ,1
sexy lay shae gets banged ,1
weird slut pee  cum ,1
 were built with the dh serving with imperial airways and its predecessors for several years,0
 was a fan magazine published in new york city,0
 competitors  men and  women took part in  events in  sports,0
 kids and a cop is a  documentary short directed by charles barton about the philanthropic work of the lou costello jr youth foundation in los angeles california named after the comedians son who had died in  aged ,0
 did come out of beta and was released on distrowatchcom,0
sell your gf   enjoys watching  gf olivia grace fuck teen porn ,1
sexy hot aunty sex in private appartment ,1
 avenue cuts through the neighborhood,0
black is better  personal shopper starring  applegate  isiah maxwell clip ,1
 years of the best journalism by women published as journalistas  years of the best writing and reporting by women journalists in the united states,0
 moved with the suburb of morphett vale from reynell and smaller numbers from mawson and mitchell,0
wild fuck after relaxing shower ,1
 is a scripted miniseries about a poker game,0
th street was an express station on the demolished irt ninth avenue line,0
 biggest hits is a compilation album from the country music band diamond rio,0
bit key strong bit key and bit key standard mppe encryption schemes are supported,0
tetrabromobenzene is a fourfold symmetrically brominesubstituted benzene and starting material for liquid crystals and oled materials as well as for mono and bisaryines,0
hot stepmom  skinny teen amazing way ,1
gorgeous pakistani girl fucked in porn movie by  black cock  allvideosxcom ,1
dolly little redhead masturbating ,1
amateur teen casting compilation ,1
my husband bought  sexual slave ,1
cute  sweet babe with hairy pussy enjoys deep fucking   couch ,1
extreme long fisting ass extreme wreck ,1
 limburgia provisional designation  rv is a carbonaceous asteroid from the outer region of the asteroid belt approximately  kilometers in diameter,0
 is the debut solo album by azure rays maria taylor,0
when asked about the frequent comparisons in the australian media of the blackwell twins to male cricketers she said we look up to them a lot but female cricketers should be recognized for themselves not as the equivalent of mark waugh or steve waugh or matthew hayden or anybody,0
 squadron of the israeli air force also known as the first cobra or northern cobra squadron was formed in april ,0
 miles to the northwest is the county town of buckinghamshire aylesbury,0
ass cam  sexy girl perfect fuck pov ,1
english movie sex scene hollywood actress sex ,1
man vs woman naked wrestling with avery jane manhandled by cody carter ,1
 cars were confirmed to run in the inaugural season,0
gorgeous ladies sucking  fucking cock ,1
british college babe strips  masturbates  twat twitching orgasm ,1
 on the billboard hot  becoming his first billboard top  hit of the s and also topped the billboard album rock tracks chart for two weeks,0
 dmitri shostakovichs last was written in a little over a month during the summer of  in repino outside st petersburg,0
 of the funding past the goal amount went to impact boston which offers personal safety and selfdefense courses,0
 vrouwen uit de nederlandse geschiedenis is a compilation of  biographies of famous women of the netherlands spanning roughly  years,0
 andromedae is the flamsteed designation,0
 people registered to stand as candidates in the election,0
 volumes including  incunabula and  works written in bosnian cyrillic,0
 entries was received by sveriges television svt for melodifestivalen  with  being selected to compete in the televised final,0
 kids and counting is a threepart british documentary on channel  first shown in april ,0
fucking my homeboys fat ass thot sister love how  moans ,1
 astronautica provisionally designated  sh is a hungaria asteroid from the innermost region of the asteroid belt,0
 days after he published the app it had been bought  times and was ranked first on apple incs app store,0
get me hard  says   do what im told ,1
 thomana provisional designation  ru is a raretype carbonaceous asteroid from the outer regions of the asteroid belt approximately  kilometers in diameter,0
 was a television special that was broadcast live on july   airing on usa network in the us as the th episode of wwes flagship show raw,0
meagan  sophia porn petite perfect girls sex pics  porn videos ,1
hilarious  geek creates android  friend  hot   ava addams ,1
milf shaking  huge tits  cam  hornyslutcamscom ,1
alanah rae my husband lost  job for this  sex with other full movie ,1
erotic diary  train sex with my asian girlfriend ,1
fashion model came  fake casting in belive  get  job but only fuck agent ,1
 tkbat was disbanded and the two companies of the battalion were split up between th tkbat and nd tankbat where they became the rd company c squadron,0
asian foster daughter fucks bbc dad  busty mom ember snow  summer hart ,1
 reasons why and twin peaks and their track tick of the clock was featured in the films drive  and taken  ,0
 biggest hits is a budget priced compilation album from country music artist ricky van shelton,0
th golden raspberry awards were held on march   at the hollywood roosevelt hotel to recognize the worst the movie industry had to offer in ,0
 regularity rallies are generally conducted on open public roads alongside regular traffic without the contestants knowing the route in advance,0
taboo family ,1
 renauxa provisional designation  ec is an eon asteroid from the outer regions of the asteroid belt approximately  kilometers in diameter,0
horny teacher in pantyhose sensual masturbates pussy  orgasm ,1
rd street is a local station on the ind eighth avenue line of the new york city subway,0
cant take no dick bbc training ,1
hairy juicy cherry babes messy peeing ,1
 casting couch porn ,1
naughty america karma rx gets bullied into sucking  fucking ,1
hot big ass pawg teen creampie ,1
orgy with  goalkeeper ,1
 seconds is a television game show that aired on the nashville network from march   to september  ,0
fm is the only english radio station in the city and plays international music from an array of genres such as pop rock rock  roll rb hiphop top  hits and more,0
fucking perky ebony rave chick ,1
th arrondissement is an arrondissement in the littoral department of benin,0
 gals are getting fuck one at  time by their boyfriend ,1
extreme bizarre bdsm with slave miranda ,1
 in law is  whore ,1
euro lesbian pussy eating babes ,1
 competitors  men and  women took part in  events in  sports,0
th regiment royal artillery is a regiment of the royal regiment of artillery in the british army,0
blonde coed teen with glasses drilled roughly ,1
 of those appearances came in la liga six goals scored,0
punishment chamber porn ,1
st military intelligence battalion cewi  combat electronic warfare intelligence was part of the st infantry division fort riley kansas from  to ,0
cheated busty brunette dont like  fuck with fake agent in mea melone studio ,1
busty big ass neighbor anal fucked in bondage ,1
daddy  watching me remake ,1
 hanskya provisional designation  qd is a dark background asteroid from the outer regions of the asteroid belt approximately  kilometers in diameter,0
pentafluoropropane hfcfa is a hydrofluorocarbon used primarily for closedcell spray foam insulation produced by honeywell and in asia by sinochem,0
 teams participated in the competition which was played in matosinhos portugal from  to  july ,0
cutie young secretary horny for boss old cock fucks in  cum swallowing ,1
wife strips for husband  friends ,1
horny teen jerks off  boyfriend ,1
this is why you come  columbia ,1
 penn is an american singlecamera sitcom series about a dysfunctional family living in the white house,0
wet pussies fisted  bed ,1
hot blonde suck huge black cock while smoking ,1
vintage porn with christopher clark fucking  hot whore ,1
babe is returning dude  cunt licking with wet blow job ,1
 starriders were produced before the type was replaced by the optare metrorider in ,0
sexy girl in white leggings ,1
 field squadron is a reserve unit of the royal australian engineers of the australian army,0
 achieved on october  ,0
charlotte sartre eating ass ,1
  cc dc  was a decision of the united states circuit court of the district of columbia that was handed down april  ,0
stranger fuck my wife  hidden cam ,1
poor little sally squirt gets  teen runaway pussy punished ,1
 municipal council members were elected to the  april    march  term of office in more than  municipalities as well as  members of the  counties of denmark,0
 williams mla william watson resigned in january ,0
 years is the fifth album of the swedish black metal band nifelheim,0
 ghosts is a  american horror film written by robb white and directed by william castle starring jo morrow rosemary decamp martin milner donald woods and yearold child actor charles herbert,0
 peers has received attention from the publications pittsburgh city paper and pittsburgh magazine,0
catching my cheerleader girlfriend masturbating porn  ,1
point courier new was also the us state departments standard typeface until january  when it was replaced with point times new roman,0
th street universal initially launched as th street in the netherlands through upc netherlands on  may ,0
chubby slut nude webcam chat ,1
cute coed alisha adams sucks dick while masturbating ,1
chick is riding  thick pecker ,1
th  delaware premiered on january   at the  sundance film festival in the us documentary competition,0
teacher dreams in  office  get fucked by  nice looking big boobs having schoolgirl ,1
 landlady hunts us making  threesome  joins  paola hard  montse swinger  magic javi  juan lucho ,1
amazing pornstars   italian porn for xtime club vol  ,1
 b is a gas giant extrasolar planet located approximately  lightyears away in the constellation of draco orbiting the star hd ,0
 england players have scored centuries in test matches,0
   guruvayur  thiruvananthapuram central intercity express is a expressmail express train belonging to indian railways southern railway zone that runs between guruvayur and thiruvananthapuram central via alappuzha in india,0
 years old at the  winter olympics she finished th,0
seiu united healthcare workers east is the largest healthcare union in the united states,0
 lena was released in  and is a compilation album by swedish pop singer lena philipsson,0
morning ass fucking with perfect brunette ,1
 yellow river flood was a natural disaster affecting the area around kaifeng china during the early ming dynasty,0
 archers took part in the mens recurve qualification round with no more than  from each country and the  teams of  archers with the highest cumulative totals out of a possible  qualified for the round knockout round drawn according to their qualification round scores ,0
 competitors  men and  women took part in  events in  sports,0
amateur anal fucking compilation high quality ,1
k is an american independent record label based in pound ridge new york united states,0
 of the chassis were built four sold to bmw five to nissan and a remaining three were sold to private teams affiliated with buick,0
when mom comes home  panties come down ,1
 competitors  men and  women took part in  events in  sports,0
 acres  km of reclaimed land owned by the company was donated to form the wilds,0
 competitors  men and  women took part in  events in  sports,0
 of the total population of kandhamal district are members of a scheduled caste,0
come cute little teen masturbating ,1
 lydina provisional designation  pg is a carbonaceous background asteroid and member of the cybele group from the outermost regions of the asteroid belt approximately  kilometers  miles in diameter,0
 is isiss third live release,0
some compilations may include piano sonata no  in e minor op,0
 out of  council seats were up for election and the liberal democrat party kept overall control of the council,0
givemepink cute teen inserts  toy in  butt whilst pleasuring  pussy with ,1
fucking gorgeous sex doll  wwwsoutherntreasurescomau ,1
 teams participated in the league and hifk helsinki won the championship,0
 of those incidents of selfharm were attempts by detainees to hang themselves,0
a is a national highway in india,0
 lakhs and was inaugurated on wednesday  october ,0
 civilian passengers and crew were killed with the sinking condemned as a war crime,0
chinese model pussy play ,1
 communications acquired it from american community newspapers in the newspaper has a daily circulation as well as daily online contribution,0
mood art photo session backstage video ,1
 lancelot place is a residential building in knightsbridge london,0
sucking best friends husband thick cock ,1
boy stokes  legal age teenager niece ,1
pierced pussy senior army officer reprimands  soldier ,1
petite babe scarlet harrassed by gyno doctor ,1
 old broad street formerly known as the stock exchange tower and still often referred to as such is a highrise office building in london located on old broad street in the city of london financial district,0
pussyfucking closeup with ebony babe ,1
 of the new houseguests had an exboyfriend or girlfriend in the house playing the game as well,0
mommy watches stepteens first time anal ,1
 inmates who attempted to escaped was captured during the attack at gunfire exchange between the policemen and the gunmen,0
 friends of oregon opposed measures  and ,0
lollipop loving asian teenager courtney rides big veiny dick deep  hard ,1
  out of  of the towns population speak welsh with  of  year olds speaking the language,0
university slut let all boys screw  ,1
japanese milf with huge boobs fucked in hotel  ,1
euro babe massaged before fucking in truck ,1
wannabe mia sucks dick  camera for  first time ,1
hard anal  assfucks bent over  chair compilation ,1
 south main street is a historic home located at mount morris in livingston county new york,0
mofos  mofos  sides  bonnie  public sex city bus footage ,1
 competitors  men and  women took part in  events in  sports,0
bathroom masturbation  anal insertion ,1
 aquarii abbreviated  aqr is a double star in the constellation aquarius,0
 of their albums reached the top  in either the us or uk with five of them reaching numberone,0
 is a  americancanadian indie black comedy film written and directed by greg marcks,0
 see you like my costume  jerkoff instruction virtual sex joi ,1
 of the rivers catchment area lies within drysdale river national park,0
year old jay noble of staten island new york placed fourth,0
wankz sneaky milf seduces guy into sex ,1
 protein betaalpha is a protein that in humans is encoded by the ywhab gene,0
while we arrange  summer house ,1
two lovely blonde babes loves  get their faces jizzed together ,1
amazing couple have hot teen sex must watch ,1
angel wicky in  scene by allinternalcom trailer ,1
 teams entered the competition and switzerland defeated france in the final to win the competition for the first time,0
rd brigade support battalion is a combat support battalion of the united states army based in vicenza italy,0
fake fantasy cheating husband unloads  times  hot brunette  pussy ,1
 is a historic stationary steam engine or mill engine in miami florida,0
 capacity rwang pam stadium is their home,0
messy slut is being tied with ropes ,1
blonde facesitting bitch ,1
th arrondissement of marseille is one of the  arrondissements of marseille,0
th tournament was held on november  in iran,0
asian amatuer webcam bitch gets fucked by bbc ,1
 hours of reims official name  heures internationales de reims were a sports car endurance racing series held from  to  at the circuit reims gueux,0
girl pegging guy with strapless strapon ,1
 replied and volunteered to serve as members of the assembly,0
 is a  singaporean coming of age dark comedydrama film about teenage gangsters in the singapore suburbs,0
 respectivelythe district serves students from the city of saratoga springs and the saratoga county towns of milton wilton malta greenfield and saratoga,0
 gage was recorded in three sessions over a threemonth period at ticotico studios in finland,0
masturbating eurobabe wanks old british bloke ,1
 clubs competed in the weeklong season including finals which was eventually won by a northern new south wales club the tweed heads seagulls who beat the redcliffe dolphins  in the  grand final at suncorp stadium,0
amateur wife oral sex tape ,1
dithiazole compounds may be formed by the reaction of nitrile sulfide formed by the thermolysis of oxathiazolone with various reactive species for instance thiocarbonyls via a dipolar cycloaddition reaction,0
 argyle mla john gannon resigned in march  due to ill health,0
